{"run_id":"mohae-pilot-20260830-001","department_id":"local_places","worker_id":"lp-official","worker_mode":"memory_assisted","source_strategy":"Public web search and reading of official openings, current branch pages, official social posts, booking and merchant-commerce pages, plus release-syndication pages carrying exact opening dates.","observed_at":"2026-08-30T14:32:09+09:00","leads":[{"lead_id":"lp-official-01","raw_title":"bhc 플래그십 스토어 강남역점","raw_description":"bhc's first flagship store opened near Gangnam Station on 2026-08-04. The three-floor location offers customizable Crispy PICK chicken, box and platter menus, and K-food dishes. The official social listing shows 서울 강남구 테헤란로1길 28.","discovery_url":"https://www.thevaluenews.co.kr/news/200349","canonical_url":"https://www.instagram.com/reel/Db5NT3RzZqF/","discovered_via":"Release-syndication news page and official bhc social post","source_type":"news","market":"South Korea / Seoul / Gangnam-gu","published_at":"2026-07-28T00:00:00+09:00","observed_at":"2026-08-30T14:32:09+09:00","possible_entities":["bhc","Dining Brands Group","bhc 플래그십 스토어 강남역점","서울 강남구 테헤란로1길 28"],"raw_dates":["2026-07-28","2026-08-02 preview event","2026-08-04 official opening"],"raw_numbers":["3 floors","1,000+ preview-event applications","서울 강남구 테헤란로1길 28"],"uncertainties":["No current menu prices were visible in the inspected official opening material.","The official social excerpt showed an opening time of 11:00 but did not expose the complete daily-hours line."]},{"lead_id":"lp-official-02","raw_title":"SW19 SEONGSU PT.2","raw_description":"SW19 opened its second standalone Seongsu store on 2026-08-05. The official store directory lists it at 1F, 315-31, Seongsu-dong, Seongdong-gu, Seoul, with telephone 02-498-1990.","discovery_url":"https://www.koreadaily.com/article/20260806192931988","canonical_url":"https://en.sw19official.com/stores.html","discovered_via":"Release-syndication article cross-read with the official SW19 store directory","source_type":"news","market":"South Korea / Seoul / Seongdong-gu","published_at":"2026-08-06T00:00:00+09:00","observed_at":"2026-08-30T14:32:09+09:00","possible_entities":["SW19","SW19 SEONGSU PT.2","WAGTI Inc.","315-31 Seongsu-dong"],"raw_dates":["2026-08-05 opening","2026-08-06 article update","2026-08-10 5pm Hand & Body Care launch"],"raw_numbers":["second standalone Seongsu store","1F","315-31, Seongsu-dong","02-498-1990"],"uncertainties":["Opening hours and in-store prices were not visible on the official directory.","The date source calls the two Seoul openings simultaneous while separately giving 2026-08-05 for Seongsu and 2026-08-06 for Hongdae."]},{"lead_id":"lp-official-03","raw_title":"SW19 HONGDAE","raw_description":"SW19 opened a new Hongdae store on 2026-08-06. The official directory lists it at 1F, 119, Eoulmadang-ro, Mapo-gu, Seoul, with telephone 02-6052-1919.","discovery_url":"https://www.koreadaily.com/article/20260806192931988","canonical_url":"https://en.sw19official.com/stores.html","discovered_via":"Release-syndication article cross-read with the official SW19 store directory","source_type":"news","market":"South Korea / Seoul / Mapo-gu","published_at":"2026-08-06T00:00:00+09:00","observed_at":"2026-08-30T14:32:09+09:00","possible_entities":["SW19","SW19 HONGDAE","WAGTI Inc.","119 Eoulmadang-ro"],"raw_dates":["2026-08-06 opening","2026-08-06 article update","2026-08-10 5pm Hand & Body Care launch"],"raw_numbers":["1F","119, Eoulmadang-ro","02-6052-1919"],"uncertainties":["Opening hours and in-store prices were not visible on the official directory.","This lead shares one opening announcement with SW19 SEONGSU PT.2."]},{"lead_id":"lp-official-04","raw_title":"THE GRAND LOTTE SEOUL","raw_description":"LOTTE HOTEL SEOUL's main building reopened under the new THE GRAND LOTTE SEOUL brand on 2026-08-14. The official hotel page currently supports booking and lists 30 Eulji-ro, Jung-gu, check-in at 15:00 and check-out at 11:00. It also shows offers with reservation periods beginning 2026-08-03 and 2026-08-24.","discovery_url":"https://www.lottehotel.com/seoul-grand/en","canonical_url":"https://www.lottehotel.com/seoul-grand/ko","discovered_via":"Official hotel brand, booking and special-offer page","source_type":"official","market":"South Korea / Seoul / Jung-gu","published_at":"2026-06-25T00:00:00+09:00","observed_at":"2026-08-30T14:32:09+09:00","possible_entities":["THE GRAND LOTTE SEOUL","LOTTE Hotels & Resorts","LOTTE HOTEL SEOUL","30 Eulji-ro"],"raw_dates":["2026-08-14 brand reopening","2026-08-24 to 2026-09-30 K-Edition reservation period","2026-09-01 to 2026-11-30 K-Edition stay period","2026-08-03 to 2026-12-29 Travel Pass reservation period","2026-08-26 to 2026-12-29 Travel Pass stay period"],"raw_numbers":["30 Eulji-ro, Jung-gu","check-in 15:00","check-out 11:00","+82-2-771-1000","+82-2-759-7311~5","room/lounge offer for 2 or 3","minimum 3 nights"],"uncertainties":["The official page did not expose a room price without entering stay parameters.","The announcement publication date predates the in-scope 2026-08-14 reopening."]},{"lead_id":"lp-official-05","raw_title":"THUG CLUB SEONGSU FLAGSHIP STORE","raw_description":"THUG CLUB's official social account announced the grand opening of its Seongsu flagship on 2026-08-29 at 서울특별시 성동구 연무장19길 4, presenting FW26, TANTALUM CAT and the PERMANENT COLLECTION.","discovery_url":"https://www.threads.com/@thug_club/post/DcihtkuHXoq/video-thug-club-%EC%84%B1%EC%88%98-%ED%94%8C%EB%9E%98%EA%B7%B8%EC%8B%AD-%EC%8A%A4%ED%86%A0%EC%96%B4-%EA%B7%B8%EB%9E%9C%EB%93%9C-%EC%98%A4%ED%94%882026%EB%85%84-8%EC%9B%94-29%EC%9D%BCthug-club-%EC%84%B1%EC%88%98-%ED%94%8C%EB%9E%98%EA%B7%B8%EC%8B%AD-%EC%8A%A4%ED%86%A0%EC%96%B4%EA%B0%80-%EC%98%A4%ED%94%88%ED%95%A9%EB%8B%88%EB%8B%A4%EC%83%88%EB%A1%9C%EC%9A%B4-%EA%B3%B5%EA%B0%84%EC%97%90%EC%84%9C-26f/","canonical_url":"https://www.instagram.com/thug_club/","discovered_via":"Official THUG CLUB Threads and Instagram presence","source_type":"social","market":"South Korea / Seoul / Seongdong-gu","published_at":null,"observed_at":"2026-08-30T14:32:09+09:00","possible_entities":["THUG CLUB","THUG CLUB SEONGSU FLAGSHIP STORE","TANTALUM CAT","서울특별시 성동구 연무장19길 4"],"raw_dates":["2026-08-29 grand opening","FW26"],"raw_numbers":["서울특별시 성동구 연무장19길 4"],"uncertainties":["The post publication timestamp was not exposed.","No product prices were visible.","Daily operating hours were not visible in the official post excerpt."]},{"lead_id":"lp-official-06","raw_title":"LE17SEPTEMBRE at The Hyundai Seoul","raw_description":"LE17SEPTEMBRE's official account announced a new space on the third floor of The Hyundai Seoul opening on 2026-08-27. Its current official store page lists the branch on 3F with telephone 02-3277-0396.","discovery_url":"https://www.instagram.com/p/Dchj7yvSwVa/","canonical_url":"https://eh917.cafe24.com/store.html","discovered_via":"Official LE17SEPTEMBRE opening post and current merchant store directory","source_type":"social","market":"South Korea / Seoul / Yeongdeungpo-gu","published_at":"2026-08-27T00:00:00+09:00","observed_at":"2026-08-30T14:32:09+09:00","possible_entities":["LE17SEPTEMBRE","The Hyundai Seoul","현대백화점","여의도"],"raw_dates":["2026-08-20 Hyundai Department Store Pangyo 3F opening","2026-08-27 The Hyundai Seoul 3F opening","2026-08-28 Hyundai Department Store Trade Center 5F opening"],"raw_numbers":["3F","02-3277-0396","10:30-20:00 Monday-Thursday"],"uncertainties":["The official opening post groups three department-store openings.","No product prices or opening promotion were visible.","The complete Friday-Sunday operating-hours line was not exposed in the inspected excerpt."]}]}