{
  "run_id": "mohae-pilot-20260830-001",
  "department_id": "events_experiences",
  "worker_id": "ee-ticket",
  "worker_mode": "memory_assisted",
  "source_strategy": "Public web search and public web reading of official venue and cultural-institution inventories only.",
  "observed_at": "2026-08-30T14:32:09+09:00",
  "leads": [
    {
      "lead_id": "ee-ticket-01",
      "raw_title": "이은결 30주년 <ONE OF ONE>",
      "raw_description": "세종문화회관 공식 페이지에 세종대극장 공연 일정, 회차, 좌석별 가격과 일부 좌석 마감 공지가 표시되어 있다.",
      "discovery_url": "https://www.sejongpac.or.kr/portal/performance/performance/performTicket.do?performIdx=37328&menuNo=200320",
      "canonical_url": null,
      "discovered_via": "세종문화회관 공식 공연 인벤토리",
      "source_type": "official",
      "market": "South Korea, Seoul",
      "published_at": null,
      "observed_at": "2026-08-30T14:32:09+09:00",
      "possible_entities": ["이은결", "세종대극장", "세종문화회관", "클립서비스"],
      "raw_dates": ["2026.08.22(토) ~ 2026.09.06(일)", "08.30(일) 1회차 14:00, 2회차 18:30", "09.01(화) 1회차 19:30", "09.02(수) 1회차 19:30", "09.03(목) 1회차 19:30", "09.04(금) 1회차 19:30", "09.05(토) 1회차 14:00, 2회차 18:30", "09.06(일) 1회차 14:00"],
      "raw_numbers": ["120분", "인터미션: 0분", "7세 이상 관람 가능", "VIP석 143,000원", "R석 110,000원", "S석 88,000원", "A석 66,000원"],
      "uncertainties": ["현재 회차별 잔여 좌석 수는 공개 텍스트에서 확인되지 않는다.", "공지에는 9/5 14:00 일부 좌석이 마감되었다고 표시되어 있으나 이후 변동 여부는 확인되지 않는다."]
    },
    {
      "lead_id": "ee-ticket-02",
      "raw_title": "2026 상상톡톡미술관 기획전시 <빠씨를 찾아서>",
      "raw_description": "세종문화회관 공식 페이지에 북서울꿈의숲 상상톡톡미술관 전시 기간, 운영시간, 정가와 예매 할인이 표시되어 있다.",
      "discovery_url": "https://www.sejongpac.or.kr/portal/performance/performance/performTicket.do?performIdx=37358&menuNo=200320",
      "canonical_url": null,
      "discovered_via": "세종문화회관 공식 전시 인벤토리",
      "source_type": "official",
      "market": "South Korea, Seoul",
      "published_at": null,
      "observed_at": "2026-08-30T14:32:09+09:00",
      "possible_entities": ["상상톡톡미술관", "북서울꿈의숲", "꿈의숲아트센터", "세종문화회관"],
      "raw_dates": ["2026.07.11(토) ~ 2026.10.25(일)", "10:00~18:00", "입장마감 17:30"],
      "raw_numbers": ["성인, 어린이 전 연령 15,000원", "24개월 미만 무료", "예매할인 14%", "12,900원", "3인 가족권 30,000원", "지역주민 할인 24%", "11,400원"],
      "uncertainties": ["선택 날짜별 입장 가능 여부와 당일 혼잡도는 공개 텍스트에서 확인되지 않는다.", "공식 페이지는 평일 오전 단체 운영과 주말·공휴일 대기 가능성을 안내한다."]
    },
    {
      "lead_id": "ee-ticket-03",
      "raw_title": "한글_소리의 질감展",
      "raw_description": "세종문화회관 공식 페이지에 세종이야기전시장의 무료 전시 기간, 운영시간과 휴관일이 표시되어 있다.",
      "discovery_url": "https://www.sejongpac.or.kr/portal/performance/performance/performTicket.do?performIdx=37582&menuNo=200320",
      "canonical_url": null,
      "discovered_via": "세종문화회관 공식 전시 인벤토리",
      "source_type": "official",
      "market": "South Korea, Seoul",
      "published_at": null,
      "observed_at": "2026-08-30T14:32:09+09:00",
      "possible_entities": ["한글_소리의 질감展", "세종이야기전시장", "세종문화회관"],
      "raw_dates": ["2026.08.25(화) ~ 2026.09.21(월)", "10:00-18:30", "매주 금요일 연장운영", "매주 월요일 휴관"],
      "raw_numbers": ["30분전 입장마감", "관람 무료"],
      "uncertainties": ["금요일 연장운영의 정확한 종료 시각은 공개 텍스트에 표시되지 않는다.", "별도 예약 필요 여부는 공개 텍스트에서 확인되지 않는다."]
    },
    {
      "lead_id": "ee-ticket-04",
      "raw_title": "2026년 「거리로 나온 예술」 9월 공연 일정",
      "raw_description": "경기아트센터 공식 페이지에 경기도 10개 시·군 야외무대 및 공원에서 열리는 무료 공연 회차가 표시되어 있다.",
      "discovery_url": "https://www.ggac.or.kr/ggac/M0000155/show/view.do?idx=SM000172",
      "canonical_url": null,
      "discovered_via": "경기아트센터 공식 공연 인벤토리",
      "source_type": "official",
      "market": "South Korea, Gyeonggi-do",
      "published_at": null,
      "observed_at": "2026-08-30T14:32:09+09:00",
      "possible_entities": ["거리로 나온 예술", "경기도", "경기아트센터"],
      "raw_dates": ["2026-09-05 (토) ~ 2026-09-20 (일)", "2026-09-05 14:00", "2026-09-06 14:00", "2026-09-12 16:00", "2026-09-13 11:00", "2026-09-13 14:00", "2026-09-19 14:00", "2026-09-19 15:00", "2026-09-20 15:20", "2026-09-20 15:30"],
      "raw_numbers": ["경기도 10개 시·군", "각 회차 100분", "티켓가격 무료", "문의 031-230-3306, 3309"],
      "uncertainties": ["각 회차의 구체적인 시·군과 장소는 읽힌 공개 텍스트에 표시되지 않는다.", "공식 페이지는 기상 상황과 현장 여건에 따라 일정 및 장소가 변경될 수 있다고 안내한다."]
    },
    {
      "lead_id": "ee-ticket-05",
      "raw_title": "2026 서가콘서트: 셜록홈즈",
      "raw_description": "경기아트센터 공식 페이지에 소극장 공연 일시, 가격과 예매하기 항목이 표시되어 있다.",
      "discovery_url": "https://www.ggac.or.kr/ggac/M0000155/show/view.do?idx=SM000129",
      "canonical_url": null,
      "discovered_via": "경기아트센터 공식 공연 인벤토리",
      "source_type": "official",
      "market": "South Korea, Gyeonggi-do, Suwon",
      "published_at": null,
      "observed_at": "2026-08-30T14:32:09+09:00",
      "possible_entities": ["서가콘서트", "셜록홈즈", "경기아트센터"],
      "raw_dates": ["2026-09-08 (화) ~ 2026-09-08 (화)", "2026-09-08 19:30"],
      "raw_numbers": ["90분", "인터미션 없음", "7세 이상", "R석 35,000원", "S석 25,000원", "만원의행복석 10,000원"],
      "uncertainties": ["현재 잔여 좌석 수와 좌석 등급별 판매 가능 상태는 공개 텍스트에서 확인되지 않는다.", "만원의행복석은 공식 페이지에 명시된 경기도 거주 대상자와 현장 증빙 조건이 적용된다."]
    },
    {
      "lead_id": "ee-ticket-06",
      "raw_title": "바로크 음악의 환희",
      "raw_description": "경기아트센터 공식 페이지에 소극장 공연 일시, 전석 가격, 예매 오픈일과 예매하기 항목이 표시되어 있다.",
      "discovery_url": "https://www.ggac.or.kr/ggac/M0000155/show/view.do?idx=SM000169",
      "canonical_url": null,
      "discovered_via": "경기아트센터 공식 공연 인벤토리",
      "source_type": "official",
      "market": "South Korea, Gyeonggi-do, Suwon",
      "published_at": null,
      "observed_at": "2026-08-30T14:32:09+09:00",
      "possible_entities": ["바로크 음악의 환희", "경기아트센터", "서울바로크앙상블"],
      "raw_dates": ["2026-09-06 (일) ~ 2026-09-06 (일)", "2026-09-06 17:00", "2026. 8. 24(월) 오픈"],
      "raw_numbers": ["약 120분", "인터미션 10분", "8세 이상 관람가", "전석 1만원", "문의 031-230-3262"],
      "uncertainties": ["현재 잔여 좌석 수는 공개 텍스트에서 확인되지 않는다.", "예매 오픈 시각은 공개 텍스트에 표시되지 않는다."]
    }
  ]
}
