{
  "run_id": "mohae-pilot-20260830-001",
  "department_id": "local_places",
  "worker_id": "lp-edge",
  "worker_mode": "memory_assisted",
  "source_strategy": "Public web search and public-page reading across non-food, wellness, retail, IP-collaboration, packaged-product, event-listing, official social, and small-operator channels, with Seoul-capital-region priority.",
  "observed_at": "2026-08-30T14:32:09+09:00",
  "leads": [
    {
      "lead_id": "lp-edge-01",
      "raw_title": "올리브베러 썸머 웰니스 스탑",
      "raw_description": "올리브베러가 강남·상암·광화문·여의도·성수에서 운영한 이동형 웰니스 팝업. 앱 화면 인증, 현장 사진 인증, 아보카도 오일 스틱과 마녀스프 증정 내용이 공개됐다.",
      "discovery_url": "https://cosinkorea.com/mobile/article.html?no=58010",
      "canonical_url": "https://www.instagram.com/reel/DcksCJLz8Ri/",
      "discovered_via": "Public web search for 2026 Seoul wellness pop-ups, followed by article reading.",
      "source_type": "news",
      "market": "South Korea, Seoul",
      "published_at": "2026-08-04T15:26:35+09:00",
      "observed_at": "2026-08-30T14:32:09+09:00",
      "possible_entities": ["CJ올리브영", "올리브베러", "OLIVE BETTER", "올더베러"],
      "raw_dates": ["2026.08.01-2026.08.10", "1~2일 강남 코엑스 광장", "3~4일 상암 문화광장", "5~6일 광화문 동아 미디어 센터", "7~8일 여의도 한강공원 이랜드 크루즈 앞", "9~10일 성수역 2번 출구 앞", "모두의 잘 먹기 프로젝트: 2026.09.30까지"],
      "raw_numbers": ["아보카도 오일 스틱 7일분", "마녀스프 3종 가운데 1종", "서울 주요 상권 5곳"],
      "uncertainties": ["공식 인스타그램 게시물의 게시 시각은 검색 결과에서 확인되지 않았다.", "장소별 일일 운영시간과 수량별 재고는 기사에 표시되지 않았다.", "관찰 시점에는 이동형 팝업 운영 기간이 종료된 상태다."]
    },
    {
      "lead_id": "lp-edge-02",
      "raw_title": "캐릭터 라이선싱 페어 2026",
      "raw_description": "서울 코엑스에서 콘텐츠 IP, 캐릭터, 애니메이션, 게임, 방송, 완구, 굿즈, 보드게임을 다룬 전시. 한류 IP관에서는 K-콘텐츠와 리빙·뷰티·패션 등 산업의 협업 제품을 공개했다.",
      "discovery_url": "https://www.peoplegate.co.kr/2026/07/character-licensing-fair-2026-news.html",
      "canonical_url": null,
      "discovered_via": "Public web search for 2026 IP-collaboration and packaged-product events, followed by article reading.",
      "source_type": "news",
      "market": "South Korea, Seoul, Gangnam-gu, COEX",
      "published_at": "2026-07-12T00:00:00+09:00",
      "observed_at": "2026-08-30T14:32:09+09:00",
      "possible_entities": ["문화체육관광부", "한국콘텐츠진흥원", "KOCCA", "코엑스", "락앤락", "롯데GRS", "이마트24", "코레일유통", "현대백화점"],
      "raw_dates": ["2026.07.16-2026.07.19", "4일간"],
      "raw_numbers": ["25회", "코엑스 1층 A & B1홀", "신진 및 아마추어 작가 20명", "입장료 무료"],
      "uncertainties": ["기사 본문에서 행사 공식 홈페이지 URL은 확인되지 않았다.", "개별 협업 제품의 판매 여부와 가격은 확인되지 않았다.", "관찰 시점에는 행사가 종료된 상태다."]
    },
    {
      "lead_id": "lp-edge-03",
      "raw_title": "T1 암행천문: 별을 헤다",
      "raw_description": "T1과 SK텔레콤이 성수 T Factory에서 운영하는 장기 체험형 팝업. T1 우승 역사, 트로피, 선수 실착 유니폼, 굿즈 현장 수령 흐름이 공개됐다.",
      "discovery_url": "https://m.blog.naver.com/goblin_cne/224326884809?recommendCode=2&recommendTrackingCode=2",
      "canonical_url": "https://t1.fan/shop/category?categoryKey=01KTRFS31M8PHSGSNNGSW1QGTQ",
      "discovered_via": "Public web search for T1 Seongsu July 2026 pop-up details.",
      "source_type": "community",
      "market": "South Korea, Seoul, Seongdong-gu, Seongsu",
      "published_at": "2026-06-25T13:52:00+09:00",
      "observed_at": "2026-08-30T14:32:09+09:00",
      "possible_entities": ["T1", "SK텔레콤", "T Factory"],
      "raw_dates": ["2026.07.02-2026.09.13", "입장 사전 예약 오픈: 2026.06.19 정오", "MD 현장 수령 예약 오픈: 2026.06.24 정오"],
      "raw_numbers": ["T Factory 1~2층", "약 두 달 반", "성수역 4번 출구"],
      "uncertainties": ["발견 페이지는 제3자 블로그이며 일부 혼잡도 표현은 작성자 전망이다.", "관찰 시점의 잔여 예약 회차와 현장 입장 가능 여부는 확인되지 않았다.", "공식 예약 페이지의 개별 상품·예약 상태는 직접 확인되지 않았다."]
    },
    {
      "lead_id": "lp-edge-04",
      "raw_title": "STORY A 성수: 뷰티서바이벌 살인사건",
      "raw_description": "아모레성수 2층에서 운영되는 뷰티 사이언스 미스터리 기반 크라임씬·방탈출형 프로그램. 참가자가 수사단 역할로 우승자 사망 사건의 단서를 찾는 구성이다.",
      "discovery_url": "https://www.etnews.com/20260730000261",
      "canonical_url": "https://m.booking.naver.com/booking/12/bizes/1696844/items/785624",
      "discovered_via": "Public web search for Amore Seongsu escape-room and beauty-survival opening details.",
      "source_type": "news",
      "market": "South Korea, Seoul, Seongdong-gu, Seongsu",
      "published_at": "2026-07-31T00:00:00+09:00",
      "observed_at": "2026-08-30T14:32:09+09:00",
      "possible_entities": ["아모레성수", "STORY A 성수", "BSMIT"],
      "raw_dates": ["2026.07.28-2026.10.18", "운영시간 11:00-20:00", "월요일 휴무"],
      "raw_numbers": ["아모레성수 2층", "1인 15,000원", "83일간"],
      "uncertainties": ["1인 15,000원은 검색 결과에서 오픈 특가로 표현돼 관찰 시점에도 동일한지 확인되지 않았다.", "83일이라는 수치는 제3자 행사 페이지에서 노출됐다.", "관찰 시점의 예약 가능 회차는 확인되지 않았다."]
    },
    {
      "lead_id": "lp-edge-05",
      "raw_title": "torriden connect X CORTIS 딥 다이브 뉴스 팝업",
      "raw_description": "토리든이 코르티스와 진행한 딥 다이브 뉴스 캠페인의 성수 오프라인 팝업. 업그레이드된 다이브인 저분자 히알루론산 세럼, 구매자 대상 랜덤 추첨과 구매 사은품이 공개됐다.",
      "discovery_url": "https://world.nol.com/en/content/articles/f7c8892d-4aa3-485b-b129-b675a84cdcff",
      "canonical_url": "https://www.instagram.com/torriden_connect/",
      "discovered_via": "Public web search across beauty, packaged-product, K-pop collaboration, and Seongsu channels.",
      "source_type": "platform",
      "market": "South Korea, Seoul, Seongdong-gu, Seongsu",
      "published_at": "2026-07-24T00:00:00+09:00",
      "observed_at": "2026-08-30T14:32:09+09:00",
      "possible_entities": ["토리든", "Torriden", "코르티스", "CORTIS", "토리든 커넥트 성수"],
      "raw_dates": ["2026.07.15-2026.12.31", "캠페인 공개 발표: 2026.07.08", "관련 기사: 2026.07.09", "관련 기사: 2026.07.10"],
      "raw_numbers": ["서울 성동구 성수이로7가길 17", "커넥트 성수 3층"],
      "uncertainties": ["이벤트 목록은 영문 제3자 페이지이며 공식 계정에서 동일 종료일을 직접 확인하지 못했다.", "랜덤 추첨과 구매 사은품의 조건·수량은 검색 결과에 구체적으로 표시되지 않았다.", "커넥트 성수 3층의 사전예약 안내가 이 팝업 자체에 적용되는지는 확인되지 않았다."]
    },
    {
      "lead_id": "lp-edge-06",
      "raw_title": "PRO-SPECS × 김참새: 우리의 친구 프로스펙스 수원 팝업",
      "raw_description": "프로스펙스와 김참새 작가의 두 번째 팝업으로 소개된 수원 행사. 스포츠를 즐기는 동물 그래픽을 활용한 '움직이는 동물 친구들' 컬렉션과 PS 슈즈 '마라톤 110'이 노출됐다.",
      "discovery_url": "https://popga.co.kr/popup/8666",
      "canonical_url": "https://m.prospecs.com/planning.do?cmd=getPlanningDetail&datacls=10262",
      "discovered_via": "Public web search for capital-region retail and artist-collaboration pop-ups outside Seoul restaurant categories.",
      "source_type": "platform",
      "market": "South Korea, Gyeonggi-do, Suwon",
      "published_at": null,
      "observed_at": "2026-08-30T14:32:09+09:00",
      "possible_entities": ["프로스펙스", "PRO-SPECS", "김참새", "아이엠샵"],
      "raw_dates": ["2026.08.21-2026.08.30", "매일 11:00-20:00"],
      "raw_numbers": ["1981년부터", "PS 슈즈 마라톤 110"],
      "uncertainties": ["행사의 정확한 수원 주소는 검색 결과 본문에서 확인되지 않았다.", "프로스펙스 공식 기획전 페이지는 서촌 팝업을 명시해 수원 행사의 공식 상세 페이지인지 확인되지 않았다.", "행사 목록의 게시일은 표시되지 않았다.", "관찰일이 공개된 마지막 운영일과 같다."]
    }
  ]
}
