{"run_id":"mohae-pilot-20260830-001","department_id":"local_places","worker_id":"lp-index","worker_mode":"memory_assisted","source_strategy":"Public map-adjacent platforms, editorial opening indexes, official venue and retailer pages, news reports, and search indexes for Seoul-capital-region openings, renewals, branches, offers, and visible price observations dated 2026-07-01 through 2026-08-30.","observed_at":"2026-08-30T14:32:09+09:00","leads":[{"lead_id":"lp-index-01","raw_title":"스타필드 마켓 월계점 그랜드 오픈","raw_description":"이마트 월계점을 이마트·트레이더스·전문점·문화 및 휴식 공간이 결합된 서울 첫 스타필드 마켓으로 리뉴얼해 2026년 8월 27일 개장했다. 180평 규모 가족 공간, F&B 매장 약 80% 재편, 3배 확장된 올리브영이 보도됐다. 9월 2일까지 한우·과일·계란 등을 최대 50% 할인하고, 네스프레소 팝업은 9월 9일까지 운영한다고 기재돼 있다.","discovery_url":"https://www.yna.co.kr/view/AKR20260826145400030","canonical_url":null,"discovered_via":"news search index","source_type":"news","market":"South Korea > Seoul > Nowon-gu > Wolgye","published_at":"2026-08-27T06:00:00+09:00","observed_at":"2026-08-30T14:32:09+09:00","possible_entities":["스타필드 마켓 월계점","이마트 월계점","트레이더스","올리브영","네스프레소"],"raw_dates":["2026-08-27","2026-09-02","2026-09-09"],"raw_numbers":["스타필드 마켓 5호점","가족 친화 공간 180평","F&B 매장 80% 재편","올리브영 기존 대비 3배 확장","노브랜드 공간 50평","최대 50% 할인"],"uncertainties":["기사에는 점포의 전체 주소와 영업시간이 표시되지 않았다.","할인 대상별 실제 판매가격은 표시되지 않았다."]},{"lead_id":"lp-index-02","raw_title":"갤럭시 로봇파크 정식 개관","raw_description":"서울 강동구의 로봇·K팝 복합문화공간으로, 보도상 2026년 8월 21일 정식 개관했다. 7~8월 프리오픈 전 회차 매진과 누적 관람객 2만 명, 정식 개관 때 신규 로봇 17종 추가 및 레스토랑·베이커리·카페 운영 시작이 보도됐다. 공개 소셜 검색 결과에는 서울 강동구 아리수로61길 103 로봇아레나와 10:00~22:00, 월요일 휴무가 표시된다.","discovery_url":"https://www.etnews.com/20260824000269","canonical_url":"https://www.instagram.com/p/DYW58VSGeee/","discovered_via":"news and social search indexes","source_type":"news","market":"South Korea > Seoul > Gangdong-gu","published_at":"2026-08-24T14:30:00+09:00","observed_at":"2026-08-30T14:32:09+09:00","possible_entities":["갤럭시 로봇파크","갤럭시코퍼레이션","로봇아레나"],"raw_dates":["2026-07-01/2026-08-31 프리오픈 언급","2026-08-21 정식 개관 보도","2026-08-22 그랜드 오픈 소셜 표기"],"raw_numbers":["누적 관람객 20,000명","신규 로봇 17종","주소 103 아리수로61길","10:00~22:00","매주 월요일 휴무"],"uncertainties":["뉴스는 8월 21일 정식 개관으로 보도하지만 소셜 검색 결과는 8월 22일 그랜드 오픈으로 표기한다.","검색 결과마다 운영시간이 10:00~20:00 또는 10:00~22:00으로 다르다.","현재 성인 무료입장 또는 티켓 가격 조건은 원문에서 완전히 확인되지 않았다."]},{"lead_id":"lp-index-03","raw_title":"도쿄장난감미술관 서울 시즌2 리뉴얼 오픈","raw_description":"현대백화점 천호점 13층의 공식 라이선스 놀이 공간이 2026년 7월 22일 시즌2로 리뉴얼 오픈했다. 공식 페이지는 기존 누적 경험자 7만 명, 천호역 직접 연결, 10:30~19:20 예약 운영을 표시한다. 공개된 현대백화점그룹 가격 정보는 아동 평일 13,000원, 주말 15,000원, 성인 4,000원이며 앱·H포인트 회원 아동 3,000원 할인이다.","discovery_url":"https://www.ehyundai.com/newPortal/EV/tokyotoymuseumseoul.do","canonical_url":"https://www.ehyundai.com/newPortal/EV/tokyotoymuseumseoul.do","discovered_via":"official venue page and search index","source_type":"official","market":"South Korea > Seoul > Gangdong-gu > Cheonho","published_at":null,"observed_at":"2026-08-30T14:32:09+09:00","possible_entities":["도쿄장난감미술관 서울","현대백화점 천호점","예술과 놀이 창조 협회"],"raw_dates":["2026-07-22 시즌2 리뉴얼 오픈","2026-07-22/2026-08-30 여름 북캠프"],"raw_numbers":["누적 경험자 70,000명","현대백화점 천호점 13F","운영 10:30~19:20","아동 평일 13,000원","아동 주말 15,000원","성인 4,000원","회원 아동 3,000원 할인","주차권 월 2장"],"uncertainties":["가격을 표시한 현대백화점그룹 보도자료의 게시일이 검색 결과에 노출되지 않았다.","시즌2에서 변경된 장난감과 공간의 전체 목록은 공식 페이지 발췌에 없다."]},{"lead_id":"lp-index-04","raw_title":"LOE BAKESHOP 서울 서초 오픈","raw_description":"서초구 서초대로42길 96에 문을 연 베이크숍으로, 에그타르트와 여러 토핑 및 커피 메뉴를 판매한다고 소개됐다. 공개된 운영시간은 월~금 08:00~18:00, 일요일 10:00~17:00이며 토요일은 휴무다.","discovery_url":"https://superfuture.com/2026/07/new-shops/seoul-loe-bakeshop-opening/","canonical_url":"https://www.instagram.com/loe_bakeshop/","discovered_via":"editorial opening index","source_type":"editorial","market":"South Korea > Seoul > Seocho-gu","published_at":"2026-07-18T00:00:00+09:00","observed_at":"2026-08-30T14:32:09+09:00","possible_entities":["LOE BAKESHOP","로에 베이크샵"],"raw_dates":["2026-07-18 editorial publication/opening label"],"raw_numbers":["주소 96 Seocho-daero 42-gil","우편번호 06649","전화 +82 10 4735 3270","월~금 08:00~18:00","일 10:00~17:00"],"uncertainties":["편집 기사 날짜가 실제 최초 영업일과 동일한지는 명시적으로 구분되지 않았다.","메뉴별 가격은 검색 결과에 표시되지 않았다."]},{"lead_id":"lp-index-05","raw_title":"애니메이트 수원점 상설 매장 리뉴얼 오픈","raw_description":"AK플라자 수원 AK& 5층에서 운영되던 팝업이 2026년 7월 16일 상설 매장으로 재개장한 것으로 공개 색인에 표시된다. 7월 오픈 기념 프로모션은 7월 16일부터 8월 15일까지였고, 공식 X 프로필에는 현재 영업시간 10:30~21:40과 AK플라자 수원점 5층이 표시된다.","discovery_url":"https://dayforyou.com/getDetail?scheduleSeq=33564","canonical_url":"https://x.com/animate_suwon","discovered_via":"discovery platform and official social profile search indexes","source_type":"platform","market":"South Korea > Gyeonggi-do > Suwon-si > Paldal-gu","published_at":null,"observed_at":"2026-08-30T14:32:09+09:00","possible_entities":["애니메이트 수원점","animate 수원점","AK플라자 수원","AK&"],"raw_dates":["2026-07-16 상설 매장 재개장/프로모션 시작","2026-08-15 오픈 프로모션 종료"],"raw_numbers":["AK플라자 수원 AK& 5F","주소 경기도 수원시 팔달구 덕영대로 924","공식 X 영업시간 10:30~21:40","프로모션 페이지 영업시간 10:30~20:00"],"uncertainties":["공식 프로필과 프로모션 플랫폼의 영업시간이 다르다.","리뉴얼 전후 면적과 취급 품목 변화는 표시되지 않았다.","오픈 기념 프로모션은 관측 시점 이전에 종료됐다."]},{"lead_id":"lp-index-06","raw_title":"KFC 용인구성DI 신규 오픈","raw_description":"KFC코리아 신규매장 페이지에 용인구성DI가 2026년 달력상 수요일인 8월 12일 오픈한 것으로 표시된다. 공개 채용 및 지역 검색 결과에는 경기 용인시 기흥구 용구대로 2427과 드라이브인 형태를 가리키는 DI 점명이 노출된다.","discovery_url":"https://www.kfckorea.com/promotion/promotionoffshop","canonical_url":"https://www.kfckorea.com/promotion/promotionoffshop","discovered_via":"official retailer opening index","source_type":"official","market":"South Korea > Gyeonggi-do > Yongin-si > Giheung-gu > Mabuk-dong","published_at":null,"observed_at":"2026-08-30T14:32:09+09:00","possible_entities":["KFC 용인구성DI","KFC코리아"],"raw_dates":["2026-08-12 inferred from official visible 08/12 (수) calendar match"],"raw_numbers":["주소 경기 용인시 기흥구 용구대로 2427","08/12 (수) 오픈"],"uncertainties":["공식 신규매장 페이지 발췌에는 연도가 직접 표시되지 않아 2026년은 요일 일치와 관측 맥락에 따른다.","공식 페이지 발췌에는 영업시간, 배달·드라이브스루 제공 여부, 오픈 할인 및 메뉴 가격이 표시되지 않았다.","주소는 공식 신규매장 페이지가 아니라 공개 채용 검색 결과에서 확인됐다."]}]}